;ID;Titre;Date;Section
L'Américain Robert Francis Prevost élu pape ;FS085;L'Américain Robert Francis Prevost, 69 ans, est devenu jeudi le premier pape originaire des États-Unis sous le nom de Léon XIV, a annoncé le Vatican.Natif de Chicago, ...;09 mai 2025 - 10:01;Société
L’asservissement des peuples par la dette : un système qui profite à quelques-uns (partie II) ;FS086;Les banquiers prospèrent sur notre endettement.Les géants pharmaceutiques tirent profit de nos systèmes de santé surendettés.Les industriels de l’armement s’enrichisse...;09 mai 2025 - 08:20;Opinions
L’asservissement par la dette – Explication des mécanismes (partie I) ;FS087;« Le pouvoir de la finance est un pouvoir de contrôle, et la dette est son arme la plus redoutable. En transformant les actifs des citoyens en instruments de spéculati...;09 mai 2025 - 08:20;Opinions
When AFP and the media betray their duty to inform : General Pellizzari's right of reply ;FS088;On this symbolic day of May 8, 2025, General Paul Pellizzari, driven by his respect for the law, the French people and his opposition to the war sees his honor sullied...;08 mai 2025 - 14:14;Société
Quand l’AFP et les médias trahissent leur devoir d'informer : le droit de réponse du général Pellizzari ;FS089;En ce 8 mai 2025, jour symbolique, le Général Paul Pellizzari, porté par le respect du droit, des Français et son opposition à la guerre via une plainte contre les min...;08 mai 2025 - 14:14;Société
Maersk : bénéfice net multiplié par 6 au 1T, porté par l'offre de transport maritime ;FS090;Les transporteurs de conteneurs se gavent, sur un marché assez peu concurrentiel, où des soupçons et des enquêtes concernant des pratiques anticoncurrentielles impliqu...;08 mai 2025 - 13:21;Société
"Perrier : Nestlé mis en demeure en France de ""retirer"" son système de microfiltration ";FS091;"Les autorités françaises ont mis en demeure mercredi Nestlé Waters, filiale du géant suisse du secteur alimentaire tant décrié ces derniers temps, de ""retirer dans un ...";08 mai 2025 - 11:28;Société
"The tension between the human and norming or ""normatization"". Preserving Creativity in a World of Frameworks - Part II ";FS092;This article is the second part of a series dedicated to the exploration of frameworks, the methodological frameworks that structure our societies, our thoughts and ou...;08 mai 2025 - 10:23;Société
"La tension entre l’humain et la ""normatisation"". Préserver la créativité dans un monde de frameworks - partie II ";FS093;Cet article est le second volet d’une série dédiée à l’exploration des frameworks, ces cadres méthodologiques qui structurent nos sociétés, nos pensées et nos actions....;08 mai 2025 - 10:23;Société
Etats-Unis : suspension des activités dans un laboratoire de haute sécurité de l’NIH après un grave incident de biosécurité ;FS094;Le directeur de l’Institut national de la santé (NIH), le Dr Jay Bhattacharya, a ordonné il y a deux semaines la suspension immédiate de toutes les activités dans un l...;08 mai 2025 - 09:33;Politique
Les arbres du parvis de la cathédrale de Chartres remplacés par 32 parasols, une pétition lancée ;FS095;Plus d'un mois après l'installation de 32 parasols sur le parvis de la cathédrale de Chartres, en remplacement de dix arbres abattus à l'automne, une pétition a été la...;07 mai 2025 - 18:25;Société
A deux semaines des législatives anticipées, le Portugal prévoit l’expulsion de 18 000 étrangers en situation irrégulière ;FS096;La question de limmigration s’invite aussi au Portugal. À l’approche des élections législatives anticipées, prévues le 18 mai prochain, le gouvernement intérimaire a a...;07 mai 2025 - 12:58;Politique
Réintroduction de pesticides : La loi Duplomb contre médecins et scientifiques ;FS097;Biodiversité et santé ont Duplomb dans l'aile. Lundi 6 mai, plus de 1 000 scientifiques, médecins et soignants ont adressé une lettre ouverte aux ministres de la Santé...;07 mai 2025 - 12:33;Société
Un artiste mis en examen pour un tableau montrant Macron décapité ;FS098;Il ne fait pas toujours bon d'être artiste en France.S'il est possible, voire de bon ton, au nom de l'Art, d'exposer des s à tendance sérieusement pédophile, il n...;07 mai 2025 - 11:15;Culture
Understanding Frameworks : Tools to Structure, Influence and Coordinate – part I ;FS099;This article inaugurates a series that will dive into the heart of frameworks, the methodological frameworks that shape the way we think, act and interact in an increa...;07 mai 2025 - 10:23;Société
Comprendre les frameworks, outils pour structurer, influencer et coordonner- partie I ;FS100;Cet article inaugure une série qui plongera au cœur des frameworks, ces cadres méthodologiques qui façonnent notre manière de penser, d’agir et d’interagir dans un mon...;07 mai 2025 - 10:23;Société
Mayotte après Chido : une crise de négligence et de promesses non tenues ;FS101;Résumé : le cyclone Chido, qui a ravagé Mayotte en décembre 2024, a révélé la négligence de la France envers son département le plus pauvre. Le refus d’Emmanuel Macron...;07 mai 2025 - 08:30;Opinions
Transfert de données : L'Europe inflige une amende de 530 millions à TikTok ;FS102;L’Union européenne a infligé 530 millions d’euros d’amende à TikTok pour non-respect de ses obligations en matière de protection des données personnelles. Le verdict e...;06 mai 2025 - 13:10;Société
Pour 2026, Uber vise les véhicules autonomes ;FS103;À l’heure où l’Europe cherche à réguler l’IA et à protéger ses emplois, Uber annonce sans détour qu’elle y déploiera ses robotaxis « sûrs, évolutifs et efficaces » dès...;06 mai 2025 - 13:05;Société
L’agenda 2030 ;FS104;Résumé : l’Agenda 2030 de l’ONU, officiellement dédié au développement durable, est perçu par certains comme un projet de contrôle global orchestré par des élites. Det...;06 mai 2025 - 12:30;Opinions
Nouvelles de Grande Bretagne : Un pays en glissade accélérée ! ;FS105;La Grande Bretagne de Starmer vit une transformation qui l’éloigne chaque jour de son passé de pays exemplaire, libéral et démocratique.Devenu leader du parti ‘labour’...;06 mai 2025 - 12:10;Opinions
Grogne des patrons de Stellantis et Renault sur le sort de l'industrie européenne ;FS106;Ça grogne chez Stellantis et Renault, les patrons pressent l'Union européenne de simplifier en urgence sa réglementation, estimant qu'elle l'empêche de proposer des vo...;06 mai 2025 - 11:50;Société
Xi Jinping en visite en Russie pour commémorer la chute de l’Allemagne nazie et renforcer les relations sino-russes ;FS107;Xi Jinping effectuera une visite officielle en Russie du 7 au 10 mai 2025, a annoncé dimanche le Kremlin. L’occasion pour le président chinois et son homologue russe, ...;06 mai 2025 - 10:24;Politique
Trump signe un décret interdisant le financement fédéral de la recherche sur le gain de fonction. Implications. ;FS108;Ce 6 mai 2025, le président Donald Trump a signé un décret exécutif historique mettant fin à tout financement fédéral pour la recherche sur le gain de fonction (GOF, p...;06 mai 2025 - 08:30;Politique
Dans le Var, des enseignants en grève après la réinsertion d'élèves harceleurs ;FS109;À Saint-Tropez, ce lundi 5 mai, près de 100 enseignants du lycée du Golfe ont cessé les cours pour dénoncer une décision qui les sidère : la réintégration de deux élèv...;05 mai 2025 - 19:25;Société
Pollution aux PFAS : 11 communes du Haut-Rhin coupées de l’eau du robinet ;FS110;Le 5 mai 2025, un arrêté préfectoral a interdit l’eau du robinet aux populations vulnérables dans 11 communes du Haut-Rhin, près de l’aéroport de Bâle-Mulhouse. Une dé...;05 mai 2025 - 19:15;Société
Présidentielle Roumaine : George Simion triomphe au premier tour dans un contexte de controverses ;FS111;Résumé : Le 4 mai 2025, George Simion, leader de l’AUR (Alliance pour l’Unité des Roumains) , a dominé le premier tour de l’élection présidentielle roumaine avec 40,96...;05 mai 2025 - 17:00;Politique
La fédération anglaise de football s’aligne sur l’arrêt de la Cour suprême et interdit aux femmes transgenres de jouer au football féminin ;FS112;Dans le sillage de la décision de la Cour suprême britannique le mois dernier, la fédération anglaise (FA) et écossaise de football (The Scottish FA) ont annoncé jeudi...;05 mai 2025 - 15:46;Politique
Au Royaume-Uni, l'extrême droite fait sauter un verrou et se voit déjà à Downing Street ;FS113;Après son succès lors d'élections locales, le parti anti-immigration Reform UK, derrière son chef Nigel Farage, voit ses ambitions décuplées au Royaume-Uni, où le plaf...;05 mai 2025 - 12:20;Politique
Présidentielle en Roumanie : Simion s’impose au premier tour avec 40,5 % des voix ;FS114;Le candidat a changé, mais la droite souverainiste reste en tête : cinq mois après l'annulation choc du premier tour de la présidentielle, la Roumanie confirme dans un...;05 mai 2025 - 11:30;Politique
L'Unesco décerne le prix de la liberté de la presse à un journal nicaraguayen ;FS115;Le prix mondial de la liberté de la presse de l'Unesco a été décerné samedi à La Prensa, un quotidien historique du Nicaragua dont la rédaction a été contrainte à l'ex...;05 mai 2025 - 09:52;Culture
Elections in Romania : Critical Electoral Irregularities, Dead People Would Vote. Press Conference by George Simion ;FS116;At a press conference held on May 4th 2025, at 1 p.m. in front of the Romanian Senate, George Simion, a major political figure in Romania, addressed the crucial issues...;04 mai 2025 - 15:00;Politique
Élections en Roumanie : irrégularités électorales critiques, des morts voteraient. Conférence de presse de George Simion ;FS117;Lors d'une conférence de presse tenue le 4 mai 2025 à 13 h devant le Sénat roumain, George Simion, figure politique majeure en Roumanie, a abordé les enjeux cruciaux e...;04 mai 2025 - 15:00;Politique
Élections présidentielles en Roumanie 2025 : un scrutin sous haute tension. George Simion en tête répond à nos questions ;FS118;Le 4 mai 2025, la Roumanie organise le premier tour de son élection présidentielle, un scrutin marqué par une crise politique sans précédent et une polarisation extrêm...;03 mai 2025 - 17:08;Politique
La doyenne de nos casseroles fête ses 100 ans, Le Creuset fait plus que jamais recette ;FS119;Grand classique des foyers français, elle fête ses 100 ans, Le Creuset, cette star des réseaux sociaux, vend désormais la grande partie de ses produits à l'étranger, n...;03 mai 2025 - 11:55;Lifestyle
Aux origines de la folie humaine ;FS120;L’omniprésence de la folie, de la perversion et de la violence pose un problème grave à l’humanité et menace la survie de la population restée saine, heureusement enco...;03 mai 2025 - 09:50;Opinions
Augmentation paradoxale des décès mondiaux liés au COVID-19 avec la couverture vaccinale. Conséquences critiques ;FS121;Résumé de l’étudeUne étude intitulée « Augmentation paradoxale du nombre de décès dus à la COVID-19 dans le monde grâce à la couverture vaccinale : estimations de l'Or...;02 mai 2025 - 21:00;Politique
CBD : Un marché juteux qui échappe à la Santé publique ;FS122;En 2025, partout en France, les boutiques de CBD pullulent. Officiellement légales, elles dissimulent pourtant un marché plus trouble qu’il n’y paraît : entre molécule...;02 mai 2025 - 17:25;Société
Les navires astreints à limiter leurs émissions de soufre en Méditerranée ;FS123;À l'heure où l'on pointe du doigt la pollution extravagante des 5 500 porte-conteneurs dans le monde, les navires circulant en mer Méditerranée vont devoir désormais f...;02 mai 2025 - 14:40;Société
Un tribunal américain inflige une lourde défaite à Apple pour les pratiques anticoncurrentielles de son App Store ;FS124;Un lourd (et nouveau) revers pour Apple. Un tribunal fédéral a accusé mercredi la firme de Cupertino de ne pas avoir respecté un verdict datant de 2021, qui opposait l...;02 mai 2025 - 13:20;Société
Une fraude académique majeure découverte par ScienceGuardians met en évidence de graves violations ;FS125;Un piége met au jour des pratiques frauduleusesScienceGuardians, une organisation dédiée à l'autonomisation de la communauté universitaire et à la défense de l'intégri...;02 mai 2025 - 12:00;Société
Major academic fraud uncovered by ScienceGuardians highlights serious violations ;FS126;An Entrapment Operation Exposes Fraudulent PracticesScienceGuardians, an organization dedicated to empowering the academic community and defending academic integrity, ...;02 mai 2025 - 12:00;Société
En Espagne, le boom des énergies renouvelables accusé d'avoir fragilisé le réseau ;FS127;Lundi 28 avril, à 12h33 précises, 60 % de l’électricité espagnole s’est évaporée en cinq secondes. Trains à l’arrêt, feux éteints, écrans noirs, et un pays champion de...;02 mai 2025 - 11:45;Société
RFK Jr. impressionne sur NewsNation et impose des tests placebo pour les vaccins ;FS128;Un leader qui suscite l’admiration et la controverseRobert F. Kennedy Jr., secrétaire à la Santé et aux Services sociaux (HHS) sous l’administration de Donald Trump, a...;02 mai 2025 - 11:30;Politique
Dans le sillage de Macron, CMA CGM navigue en eaux troubles au Moyen-Orient ;FS129;Après l’explosion dévastatrice du port de Beyrouth en août 2020, Rodolphe Saadé, PDG de CMA CGM, géant mondial du transport maritime, s’est positionné comme un acteur ...;02 mai 2025 - 10:00;Société
The United States in the Trump/RKFjr era, towards a turning point in public health ? Debriefing with epidemiologist Nicolas Hulscher ;FS130;Since the return of Donald Trump to the presidency of the United States, accompanied by emblematic figures such as Robert Kennedy and Jay Bhattacharya, the American pu...;02 mai 2025 - 09:00;Vidéos
Les États-Unis à l'ère Trump/RFKjr, vers un tournant dans la santé publique ? Debriefing avec Nicolas Hulscher épidémiologiste ;FS131;Depuis le retour de Donald Trump à la présidence des États-Unis, accompagné de figures emblématiques comme Robert Kennedy et Jay Bhattacharya, le paysage de la santé p...;02 mai 2025 - 09:00;Vidéos
La Floride criminalise la modification météorologique et la géoingénierie – Contexte scientifique et perspectives internationales ;FS132;Le 30 avril 2025, la Floride a adopté le projet de loi SB 56, devenant le premier État américain à criminaliser la modification météorologique et la géoingénierie. Sel...;02 mai 2025 - 08:46;Société
Le retour inattendu du papier chez les enfants du numérique ;FS133;En France, alors que les Millennials et la Gen Z ont grandi les yeux rivés aux écrans, on observe un retour en grâce du papier dans certaines situations. Selon plusieu...;01 mai 2025 - 20:25;Lifestyle
Compagnons IA : Une ONG alerte quant au danger qu'ils représentent pour les jeunes ;FS134;Aux États-Unis, l’ONG Common Sense alerte sur les risques psychologiques des compagnons virtuels dopés à l’intelligence artificielle. Dans une étude publiée le 30 avri...;01 mai 2025 - 20:10;Société
La séquence de Fibonacci : du titre de Liverpool FC à l’analyse du SARS-CoV-2, une convergence mathématique fascinante ;FS135;La séquence de Fibonacci, une suite mathématique où chaque nombre est la somme des deux précédents (0, 1, 1, 2, 3, 5, 8, 13, 21, …), est bien plus qu’un simple concept...;01 mai 2025 - 14:18;Société
1er mai 2025 : réveillez-vous, citoyens, vous en avez le devoir, vous en avez le pouvoir ! ;FS136;« Nos experts, c’est vous. » – Manifeste de France-Soir, 2020.En ce 1er mai 2025, la fête du travail sonne creux. Les travailleurs ploient sous des contrats précaires...;01 mai 2025 - 12:00;Opinions
Sortir de la virtualité ;FS137;Séduction et exhibition. Voici les deux mots qui me viennent pour désigner le malaise social ambiant lié à la virtualisation des rapports humains avec le tout-numériqu...;01 mai 2025 - 10:43;Opinions > Tribunes
Le ministère de la Justice américain enquête sur les revues médicales, en lien avec les préoccupations de Bhattacharya ;FS138;Début avril 2025, une annonce a secoué la communauté scientifique : le ministère de la Justice des États-Unis (DOJ) a lancé une enquête sur certaines des plus grandes ...;01 mai 2025 - 10:30;Politique
DOGE : vers un État de surveillance totalitaire selon une tribune du New York Times. Analyses et perspectives européennes ;FS139;Le New York Times, biais editorial fer de lance anti-Trump ?Le New York Times, bastion du journalisme progressiste, s’est souvent distingué par son opposition farouche...;01 mai 2025 - 10:00;Politique
Sanofi officialise la vente de sa filiale Opella et son Doliprane à un fonds américain ;FS140;Le Doliprane n’est plus français. Le groupe pharmaceutique français Sanofi a annoncé mercredi 30 avril 2025 la vente de sa filiale Opella, qui commercialise des traite...;01 mai 2025 - 09:42;Société
Hauts-de-France : capitale de la batterie ou mirage industriel européen ? ;FS141;"Depuis 2023, quatre ""gigafactories"" de batteries pour véhicules électriques émergent dans les Hauts-de-France. Porté par trois milliards d’euros d’investissements publ...";30 avril 2025 - 20:00;Société
DeepSeek épinglée par la Corée du Sud pour transfert illégal de données utilisateurs ;FS142;Surprise ! Le 24 avril, la Commission sud-coréenne de protection des données (PIPC) a révélé que DeepSeek, concurrente chinoise d'OpenAI, a transféré sans consentement...;30 avril 2025 - 19:45;Société
Les Français exigent d’être entendus : un sondage choc commandé par le Sénateur Houpert révèle une grave crise de confiance ;FS143;Un sondage commandé par le sénateur Alain Houpert (Les Républicains, Côte-d’Or), réalisé par l’institut MIS Group les 17 et 18 avril 2025 auprès de 1000 Français, met ...;30 avril 2025 - 15:00;Politique
Commerce en ligne : Bercy veut des “mesures concrètes” face à un “afflux de colis” provenant de Chine ;FS144;La liberté du commerce menacée ? Le gouvernement français voit d’un mauvais œil le flux en hausse constante de colis en provenance de Chine, dont les commandes ont été...;30 avril 2025 - 13:56;Société
Santé publique France et les médias : désinformation institutionnelle qui frôle la tromperie ? ;FS145;Une communication fallacieuse est-elle orchestrée par Santé publique France ?Le 28 avril 2025, Santé publique France (SPF) publie un communiqué dans le cadre de la Sem...;30 avril 2025 - 12:00;Société
Mode de scrutin : les ministres LR au pied du mur ... ;FS146;Les grandes manœuvres sont engagées.Afin d'avoir une majorité, il faut recourir au scrutin majoritaire. C'était la loi de la Vᵉ République. C'est ainsi qu'elle a fonct...;30 avril 2025 - 11:15;Opinions
"Toujours plus ! Pour Larcher, il n'est ""pas juste"" que les locataires ne payent pas d'impôts locaux ";FS147;"Le président LR du Sénat Gérard Larcher a jugé ""pas juste"" mercredi que ""la fiscalité locale ne repose que sur les propriétaires"" depuis la suppression de la taxe d'ha...";30 avril 2025 - 09:59;Politique
Une étude en Floride révèle des différences de mortalité entre les vaccins Pfizer et Moderna ;FS148;Résumé : Une étude menée en Floride sur 9 162 484 adultes non institutionnalisés a comparé les effets des vaccins Pfizer-BioNTech (BNT162b2) et Moderna (mRNA-1273) sur...;29 avril 2025 - 23:38;Société
Les Enfants d’Hippocrate : pour un retrait des vaccins ARNm, le soin aux victimes et le pardon collectif ;FS149;Dans une conférence de presse bienveillante « Les Enfants d’Hippocrate » nous alertaient ce mardi 29 avril sur les dangers sanitaires des vaccins ARNm, sur la nécessit...;29 avril 2025 - 20:00;Société
La Chinafrique et l’écocide en cours  : drames sociaux et environnementaux de l’exploitation chinoise en Afrique ;FS150;Le 18 février dernier, l’on apprenait que le Kafue, rivière qui traverse la Zambie du nord au sud et fournit de l’eau potable et des revenus (essentiellement liés à la...;29 avril 2025 - 15:00;Opinions
